title,url,date,source,body,image,sentiment
Altcoins Around the World: A Regional Outlook by Octa Broker,https://techbullion.com/altcoins-around-the-world-a-regional-outlook-by-octa-broker/,2024-08-24,TechBullion,"As the cryptocurrency landscape continues to evolve, altcoins are becoming increasingly important both globally and locally. From North America to Asia, these digital assets are driving innovation and reshaping financial systems. In this article, the experts at Octa, a broker with globally recognised licences, explore the key altcoins emerging from different regions, the technological advancements they bring, and the economic and regulatory factors influencing their growth. Dive into the world of altcoins to understand their potential impact on the future of digital economies.

Altcoins are rapidly gaining traction across the globe, with each region contributing unique innovations and market dynamics. This article provides a comparative analysis of leading Asian, European, and American altcoins and examines how regional regulations, technological advancements, and economic factors shape their development. Discover how these digital assets are poised to influence the global financial ecosystem and what the future might hold for them in different parts of the world.

Definition of Altcoins and Their Distinction from Bitcoin

Altcoins (short for 'alternative coins') refer to any cryptocurrency that is not Bitcoin. While Bitcoin was the first cryptocurrency and remains the most widely recognised and valued, altcoins have emerged as alternatives with different purposes, functionalities, and technologies. Unlike Bitcoin, which primarily serves as a digital store of value and a medium of exchange, altcoins often aim to improve upon Bitcoin's limitations or offer entirely new features. For instance, Ethereum, the most prominent altcoin, introduced smart contracts that allow for decentralised applications, while others, like Litecoin, focus on faster transaction speeds.

Overview of the Current Altcoin Market

The market for altcoins has grown exponentially since the early days of cryptocurrency. Today, there are thousands of altcoins, each with unique use cases and technological innovations. The market capitalisation of altcoins has increased significantly, accounting for a substantial portion of the overall cryptocurrency market. While Bitcoin continues to dominate, the combined market cap of altcoins has been steadily rising, driven by the increasing adoption of decentralised finance (DeFi) platforms, non-fungible tokens (NFTs), and blockchain-based solutions across various industries. However, the altcoin market remains highly volatile, influenced by regulatory developments, technological advancements, and market sentiment.

Importance of Altcoins for Global and Local Economies

Altcoins play a crucial role in both global and local economies. On a global scale, they contribute to the diversification of the cryptocurrency market, offering investors and users a broader range of options beyond Bitcoin. Altcoins have also been at the forefront of technological innovation, driving the development of decentralised applications, smart contracts, and blockchain solutions that have the potential to disrupt traditional industries. Locally, altcoins can empower emerging markets by providing access to financial services, enabling cross-border transactions, and fostering economic inclusion. In countries with unstable currencies or limited access to banking, altcoins can offer alternative financial systems, thus enhancing economic resilience and promoting growth.

Altcoins by Region

1.1. Americas

Ethereum (ETH)

Ethereum, developed in the United States, is the second-largest cryptocurrency by market capitalisation and the most significant altcoin in terms of impact and innovation. Unlike Bitcoin, Ethereum is not just a digital currency, it is a decentralised platform that enables the creation of smart contracts and decentralised applications (dApps). Its introduction of the Ethereum Virtual Machine (EVM) and its shift to a proof-of-stake consensus mechanism with Ethereum 2.0 have solidified its position as a leading technology in the blockchain space. The prospects for Ethereum are promising, especially as the demand for decentralised finance (DeFi) and non-fungible tokens (NFTs) continues to grow.

Solana (SOL)

Solana is another prominent altcoin originating from the Americas, particularly from the United States. It is known for its high-performance blockchain, which supports thousands of transactions per second at low costs. Solana's innovative proof-of-history consensus mechanism sets it apart, making it a strong contender in the race to scale blockchain technology. As more developers and projects migrate to Solana due to its speed and efficiency, its potential for growth in the coming years is substantial.

1.2. Europe

Cardano (ADA)

Cardano, developed by a team of engineers and academics in Europe, is a blockchain platform designed for sustainability, scalability, and interoperability. Unlike many other altcoins, Cardano's development is based on peer-reviewed research and a formal development model. Cardano aims to create a more secure and scalable blockchain network, particularly for decentralised finance applications. With its unique Ouroboros proof-of-stake consensus algorithm and focus on real-world applications, Cardano has the potential to play a significant role in the future of blockchain technology in Europe and beyond.

IOTA (MIOTA)

IOTA, another significant European altcoin, is designed to facilitate transactions between devices in the Internet of Things (IoT) ecosystem. Unlike traditional blockchains, IOTA uses a directed acyclic graph (DAG) structure called the Tangle, which allows for feeless transactions and infinite scalability. Supported by the European Union, IOTA is being integrated into various smart city projects and industrial applications across the continent. The growth of IoT and smart infrastructure in Europe bodes well for IOTA's future adoption and success.

1.3. Asia

Binance Coin (BNB)

Binance Coin (BNB) is one of the most prominent altcoins in Asia, originating from the cryptocurrency exchange Binance, which was initially founded in China before relocating to more crypto-friendly jurisdictions. BNB was initially created as a utility token for discounted trading fees on the Binance exchange, but its use has expanded significantly. BNB is now integral to the Binance Smart Chain (BSC), a blockchain platform that supports smart contracts and decentralised applications. BSC has gained popularity due to its low transaction fees and faster processing times compared to Ethereum, making BNB a central player in the Asian and global crypto markets. The widespread adoption of Binance's ecosystem across Asia positions BNB as a key altcoin with strong growth potential.

NEO

Often referred to as the 'Chinese Ethereum', NEO is a blockchain platform and cryptocurrency enabling digital assets and smart contracts development. NEO was developed in China and is designed to digitise various assets using smart contracts, focusing on regulatory compliance and a digital identity system. NEO's dual-token system, featuring NEO and GAS tokens, allows for the smooth operation of the network and provides incentives for developers and users. Despite strict cryptocurrency regulations in China, NEO has managed to maintain relevance, especially in projects that require a combination of blockchain technology and regulatory oversight. With China's growing interest in adopting blockchain technology for its digital economy, NEO is well-positioned to play a significant role in the region's blockchain development.

Polygon (MATIC)

Polygon, formerly known as Matic Network, is an Indian-origin blockchain platform that addresses some of Ethereum's major scalability issues. By providing a Layer 2 scaling solution, Polygon enhances transaction speed and reduces fees on the Ethereum network. With the growing interest in decentralised finance and the increasing number of dApps being built on the Ethereum platform, Polygon's importance and adoption are likely to grow. Its strong foundation in India, a country with a burgeoning tech industry, positions Polygon as a critical player in the global altcoin market.

Vexanium (VEX)

Vexanium is a blockchain platform from Indonesia designed to support decentralised applications (dApps) and digital marketing solutions. It aims to provide an accessible blockchain platform for businesses and developers in Indonesia and other Southeast Asian countries. Vexanium's focus on local businesses and its adaptability to regional markets give it a unique edge in the Asian altcoin landscape. As blockchain adoption increases in Southeast Asia, Vexanium has the potential to grow significantly within this emerging market.

2.1. Technological Innovations

Impact of DeFi and NFTs on Altcoin Development

Decentralized Finance (DeFi) and Non-Fungible Tokens (NFTs) have been among the most significant drivers of technological innovation in the altcoin space. DeFi platforms allow users to access financial services such as lending, borrowing, and trading without intermediaries, using smart contracts on blockchain networks. Altcoins like Ethereum, Solana, and Polygon have become central to the DeFi ecosystem due to their ability to support these decentralized applications (dApps). The growth of DeFi has also led to the creation of numerous specialized altcoins that cater specifically to this market, offering unique features and governance models.

Similarly, NFTs have opened new avenues for digital ownership and creativity, with altcoins like Ethereum and Binance Coin playing crucial roles in the minting and trading of NFTs. The rise of NFTs has also sparked the development of new blockchain networks optimized for these tokens, further diversifying the altcoin market. As DeFi and NFT adoption continue to expand, altcoins that support or innovate within these sectors are likely to see increased demand and development.

Advancement of Smart Contracts and Network Scalability

Smart contracts, self-executing contracts with the terms of the agreement directly written into code, have revolutionized the way transactions and agreements are handled on blockchain networks. Ethereum pioneered this technology, but many other altcoins have since built upon and improved it. For example, Cardano's use of a formal development model and peer-reviewed research in the implementation of smart contracts aims to enhance security and scalability.

Scalability remains one of the biggest challenges for blockchain networks, and various altcoins are addressing this in different ways. Solana's proof-of-history consensus mechanism allows it to process thousands of transactions per second, making it one of the fastest blockchains available. Similarly, Polygon's Layer 2 solution helps alleviate congestion on the Ethereum network by handling transactions off-chain, significantly reducing fees and improving transaction speed. These innovations in smart contracts and scalability are critical for the continued growth and adoption of altcoins.

2.2. Regulatory Issues

Variations in Cryptocurrency Regulations Across Countries

The regulatory environment for cryptocurrencies varies significantly from one country to another, impacting the development and adoption of altcoins. In the United States, regulatory bodies like the SEC have been scrutinising cryptocurrencies with a focus on ensuring compliance with securities laws. While this regulatory uncertainty can create challenges for altcoins operating within the U.S., it also pushes developers to create more robust and compliant systems.

In Europe, regulations are generally more liberal, with the European Union working on frameworks like the Markets in Crypto-Assets (MiCA) regulation to provide clarity and support for the growth of digital assets. Altcoins in Europe, such as IOTA and Cardano, benefit from this relatively favourable regulatory environment, which encourages innovation while protecting investors.

Asia presents a mixed regulatory landscape. Some countries, like China, have imposed strict regulations, including outright bans on cryptocurrency trading, which pose challenges for NEO and other Chinese altcoins. However, other countries in the region, such as Japan and South Korea, have adopted more crypto-friendly regulations, allowing for the development and growth of local altcoins. India's regulatory stance is rapidly evolving via ongoing discussions about regulating cryptocurrencies, which will significantly impact the future of Indian altcoins like Polygon.

Impact of Regulations on Altcoin Development and Adoption

Regulations play a pivotal role in adopting and developing altcoins. Strict regulations can hinder the growth of altcoins by limiting their accessibility and use cases. Conversely, clear and supportive regulations can foster innovation and encourage the broader adoption of cryptocurrencies. For instance, the positive regulatory environment in countries like Switzerland has made it a hub for blockchain and cryptocurrency innovation, attracting projects from around the world.

In contrast, ambiguous or hostile regulations can stifle innovation and drive projects to relocate to more favourable jurisdictions. The regulatory environment also affects investor confidence, with clear regulations providing a sense of security and encouraging institutional investment in altcoins. As global regulatory frameworks continue to evolve, the adaptability of altcoins to these changes will be crucial to their long-term success.

2.3. Economic Factors

Impact of Economic Unrest on Altcoins' Appeal

Economic instability, such as inflation, currency devaluation, and financial crises, often drives interest in cryptocurrencies, including altcoins. In countries experiencing hyperinflation or a lack of trust in the local currency, citizens may turn to altcoins as a store of value or a means of conducting transactions. For example, in Venezuela, where inflation has reached extreme levels, altcoins like Dash have gained popularity as alternatives to the national currency.

Similarly, in countries with unstable political or economic environments, altcoins can provide a hedge against local economic conditions. The decentralised nature of cryptocurrencies allows users to bypass traditional financial systems, offering a level of financial autonomy that is particularly appealing in times of economic uncertainty.

Role of Altcoins in the Development of Digital Economies

Altcoins are increasingly playing a crucial role in developing digital economies, particularly in emerging markets. By offering alternatives to traditional financial systems, altcoins can foster financial inclusion, especially in regions with limited access to banking services. Altcoins also enable the creation of new economic models, such as token economies, where users can earn, trade, and spend tokens within specific ecosystems.

According to Kar Yong Ang, a financial market analyst at Octa Broker, 'As digital economies continue to expand, the role of altcoins in these ecosystems is likely to increase, offering new opportunities for economic growth and innovation.'

Octa is an international broker that has been providing online trading services worldwide since 2011. It offers commission-free access to financial markets and various services already utilised by clients from 180 countries with more than 42 million trading accounts. Free educational webinars, articles, and analytical tools they provide help clients reach their investment goals.

The company is involved in a comprehensive network of charitable and humanitarian initiatives, including the improvement of educational infrastructure and short-notice relief projects supporting local communities.

Octa has also won over 70 awards since its foundation, including the 'Best Educational Broker 2023' award from Global Forex Awards and the 'Best Global Broker Asia 2022' award from International Business Magazine.

Related Items:2024 Technology, tech Recommended for you Pros and Cons of Purchasing Instagram Followers: What to Know Sparkly Maid Houston: Serving the Greater Houston Area with Excellence How Does Sidr Honey Improve Brain Health?",https://techbullion.com/wp-content/uploads/2024/08/Screenshot_20240824-151947_Docs.jpg,0.2862745098039217
